2 | 2013 Yes, 2014 Not So Much When I filled my tax return for 2013 I was very satisfied with Turbo Tax, this year not so much. The product itself was good and pretty easy to use. My issues lay more with customer care(service). Some life situations were pretty complicated for my family last year seeing as we are a military family. There were a few things that I needed help with. I submitted my question, got my "Incident ID #", called the number they gave and waited over an hour for someone to call me back. I ended up doing this a few times attempting to get help just once. Each time I got a call back it was from Product Support who couldn't help. A couple people transferred me to Tax Support for the help I needed. I ended up being on hold for hours at a time when transferred. Another time I was given a direct number for Tax Support. When I called I was asked for my "Incident ID #" or to press zero by an automated system. With both I got the same response... My questions weren't important because they didn't pertain to the deadline and that if I wanted them answered I could call back after the sixteenth of April, then it hung up on me. I still have yet to talk to someone in Tax Support. I finally gave up and went elsewhere for help that way our taxes could be filed before the deadline. I understand that they get swamped this time of the year, HOWEVER, it doesn't make it right for them to put a number for tax help that is really for product help or to leave people on hold just because they want to go home when they have people who have been on hold for hours before they are supposed to close and when it was an estimated wait of only sixty minutes that turned into a minimum of two hours -not including the hour or so waiting for someone to call in the first place. In all I would recommend Turbo Tax for the product itself, NOT for the help. When help was needed it was nowhere to be seen like it was claimed to be. | 45000166|0|0|0|1|0|0|0|0|0|0|0|0|0|0|831
2 | Gouged Extra charges for a Schedule E was a new twist for 2014. It felt like we were getting gouged for something that didn't cost extra before. Had to pay extra $30 upgrade for a Schedule E form | 45000156|1|0|0|0|0|0|0|0|0|0|0|0|0|0|832
3 | Turbo "Nickel and Dime me to Death" Tax Necessary evil is Turbo Tax. A lot of the requests are ambiguous and require analysis of the questions and research. Yuck! | 45000152|1|0|0|0|0|0|0|0|0|0|0|0|0|0|833
1 | System prevented me from using Credit Card The system prevented me from using a credit card to pay the hidden state filing fee. It kept telling me there was internet connectivity problems, when I knew there were not. very suspicious.  | 45000149|1|1|0|0|0|0|0|0|0|0|0|0|0|0|834
3 | didn't help much with sale of second home details disappointed didnt handle deleading tax credit without manual form | 45000148|0|0|0|0|0|1|0|0|0|0|0|0|0|0|835
3 | Federal Free I love Turbo tax, it's simply and user friendly. That being said I think it would be beneficial to make the pricing a little more clear in the beginning. I ended up paying for the federal version when I really needed to be federal free. It all evens out in the end so I didn't stress about it but, in order to get the Federal free version as originally anticipated I would have had to start completely over. Maybe making it to where to you don't have to start from scratch would make it a better experience for the non-tax professional, like myself. Not clean with the pricing | 45000147|0|1|0|0|0|0|0|0|0|0|0|0|0|0|836
3 | Too Many Extra Fees for More Than Three Stars Did the job, but last minute fees for state prep and filing were more than what I paid for the product to begin with. Extra fees | 45000142|1|0|0|0|0|0|0|0|0|0|0|0|0|0|837
1 | Disgusted with turbotax Terrible experience. Tried to e-file on 4/15/2015. Efile kicks an error message when trying to access "store" to pay for State e-file. Tried repetitively, tried online support, tried phone support, could not get any help. Post offices closed now and state will be late. Thanks Turbotax. Have used for several years. Last few years been bad. Will NEVER use Turbotax again and you will get plenty of "free advertising" from me regarding my experience. Major functionality issues | 45000141|0|0|0|1|0|0|1|0|0|0|0|0|0|0|838
2 | Highway Robbery This application used to be priced reasonably...but NOT anymore. AND they actually make a cruddy experience of paying Uncle SAM even worse by charging extra ($6) to pay by credit card... COSTS TOO MUCH | 45000136|1|0|0|0|0|0|0|0|0|0|0|0|0|0|839
3 | not as user friendly as the past after downloading last years information about my employer, it wanted to skip to the end and have me file the information without even asking about any deductions or changes in my household. Just didn't find it as user friendly. i have used this product for many years, this year I didnt find it as user friendly | 45000135|0|0|0|0|0|1|0|1|0|0|0|0|0|0|840
1 | Takes advantage of people who file last minute It was easy to use, but I really don't appreciate it being double the price. I remember getting a spammy email saying "last day to get normal pricing", so it seems like they are taking advantage of people who wait till the last week to do their taxes (thats MOST people I know). Too expensive...more then twice as much as last year... | 45000132|1|0|0|0|0|0|0|0|0|0|0|0|0|0|841
2 | Disappointed I have faithfully used turbo tax since 2006 and i have recommended the service to many of my friends, but now I am going to seek out an alternative software. I am very disappointed that turbo tax continues to increase its prices and adds ambiguous fees. The cost of using turbo tax has increased significantly | 45000122|1|0|0|0|0|0|0|0|0|0|0|0|0|0|842
3 | What happened I loved Turbo tax from Day 1...a few years ago. today I had the worst experience. Hard to get around, make changes, explanations are hard to understand, maybe I am just getting too old! What happened to two the program. | 45000103|0|0|0|0|0|0|0|1|1|0|0|0|0|0|843
1 | Convenient, but Pricey Convenient, but pricey. I have no mortgage, children to claim, etc. I could have filed the 1040 EZ, but because I sold about 10 shares of stock I had to pay $80 on top of the $40 for the state return. I ended up losing money. Expemsive | 45000097|1|0|0|0|0|0|0|0|0|0|0|0|0|0|844
3 |    | 45000095|0|0|0|0|0|0|0|0|0|0|0|0|1|0|845
2 | Disappointed I haven't used TurboTax for a few years and I ordered it online this year because I had taken a partial withdrawal from my IRA.
I was very confused on some of the explanations, and final had to consult a professional in order to reenter some figures in the right place.
It was not only hard for me to understand some parts, but the tax professional I was using was not happy not being able to view the forms, as they progressed through TurboTax questions.
Maybe buying the actual program would have been a different experience, but it's too late now. Unable to view forms, not good explanations | 45000075|0|0|0|0|0|0|0|1|0|0|0|0|0|0|846
1 | EXPENSIVE AND MISLEADING  very expensive for filing basic taxes | 45000069|1|0|0|0|0|0|0|0|0|0|0|0|0|0|847
2 | Repeated Debt to IRS with Turbo-Tax Everything was fine until you get to the part of community property income in Texas. Questions are a little confusing and it still does not make sense to me. I am filing as married but separated this year. Every year I try to max out the recommended tax withholding's to avoid any high tax bills but every year I end up owing close to $1000. I have never received a return with turbo tax. Not easy to understand some parts | 45000067|0|0|0|0|0|0|0|0|1|0|0|0|0|0|848
1 | Stop being so Positive! I owed this year, first time I have ever owed money. It wasn't much compared to some people, only $410. But it is still depressing and certainly something I don't want to do. I work VERY hard for my money all year long. The website kept everything peppy and happy AS IF I WAS going to get a refund. Come on, tell it like it really is. Cheer me up for having to owe money, make me feel better about the situation. Don't make it sound like using TurboTax is the greatest thing in the world when I have to PAY THE GOVERNMENT my money. It was such a slap in the fave every time I would hit "Continue" and the website would say "You're almost to your refund!". To darn happy! | 45000065|0|0|0|0|0|0|0|0|1|0|0|0|0|0|849
2 | #nickelanddimeme Errors that just take you in circles! I've been using Turbo Tax for along time, but was very disappointed this year, no free filing, charging for everything! Can only file 5 returns? Needs to be disclosed before you buy and maybe a warning when you get to number 4.! Charging for everything. No free filing, have to pay for state | 45000061|1|0|0|0|0|0|0|0|1|0|0|0|0|0|850
1 | free? Thought I was doing free and wasn't because of this deceiving site. I owed about the same amount on my taxes as the fee they charged. I though I was paying the amount due....nope just paid turbotax. Enjoy the free money you worthless **** never using you again and I hope your family burns a slowly while you watch said it would be free.... | 45000057|1|1|0|0|0|0|0|0|0|0|0|0|0|0|851
2 | TurboTax The app is easy to use but I feel like I got side-swiped when I went to 'send' my forms. First, I had to change to the more expensive home & business version because my wife was contracted #not employed# by a mother's-day-out. Fine, pay the extra for 1 form #Schedule C#. I go to check-out and say pay the TurboTax Home & Business version from my refund and I'm charged an additional $35 for the benefit of paying from my refund. $85 for TT and an additional $35 fee to use my refund. Tends to repeat things too much. A fee for paying for TurboTax with my refund, really? | 45000050|1|1|0|0|0|0|0|0|0|0|0|0|0|0|852
1 | Rip Off They only let you take their money out of your federal return if you pay an extra $30, but when the window comes up it says something like "Your tax fees are waived bla bla if you upgrade to Turboplus and pay with your federal return"
So when you actually do update, they charge you the $30 for your state, and the extra $30 bucks on top of that, but by the time you realize that you are so far into the process you just want to be done with it.
Honestly if I had my credit card on me I would have saved myself the $30 dollar convenience fee, but unfortunately my wife has my wallet in her purse, and today is the last day for tax day.
Go figure.
Bottom line is I really feel like there are no additional services provided for the $30 other then the fact that I can get online and look over my taxes during the year. (Why i would do this is a mystery to me).
I can pay $30 for a service, but at the point that I'm already DONE with all the hard stuff, paying $30 bucks to not have to enter my credit card number is complete rubbish.
AND THEN, to top it all off they make you take your refund onto a prepaid debit card if you choose this option! REALLY?! So for that extra $30 bucks you can't even give me a check?
I feel like its a rip off to be honest. Selling an upgrade on a service after the service is already pretty much completed is petty, gimmicky, phony, misleading etc. Pick your adjective. REALLY hardball you into buying their stuff. | 45000030|1|1|0|0|0|0|0|0|0|0|0|0|0|0|853
3 | Confused and no help Options for inputting data for RRB-1099-R are not clear and leaves you searching and reviewing more than should be necessary. There are 3 options to choose for receiving the benefit (and you must pick one) on the screen for the RRB-1099-R , none of them apply to my situation. I received this as a divorce settlement - I am not retired or disabled nor am I an RR employee. Take a chance and pick something and hope it doesn't make a difference. Locating where to document the data from your tax form should be more user friendly. Can't seem to get a valid answer | 45000027|0|0|0|0|0|0|0|1|1|0|0|0|0|0|854
1 | Pricey! I sold a couple of stocks....I don't own a home, have children to claim etc....I could have used the 1040EZ, but because I sold about 10 shares of stock I had to pay $80 for fedreral on top of the $40 for the state return. Next year. I think I'll do my own returns! Expemsive | 45000021|1|0|0|0|0|0|0|0|0|0|0|0|0|0|855
1 | Misleading on completing multiple returns Turbo Tax online and the CD/Download versions are different in terms of paying once and completing multiple returns. After paying once to file my return and believing I could do up to 5 returns, I was forced to pay again to file my sons return.Very disappointed to go all the way through the effort to enter data only to find out at the end that I have to pay again because it was the online version rather than the CD/Downloaded version. Great tax software, and very upset to pay twice for something that is advertised to be used for up to 5 returns.  | 45000005|0|0|0|0|0|1|0|0|0|0|0|0|0|0|856
3 | Easy file this year I appreciate you need to recoup your money and make a profit on the state returns, but it it not worth my money. I have printed and submitted a paper form.

Also this year my discount was not applied What happened?? Price to file state taxes, Did not receive my discount | 45000003|1|0|0|0|1|0|0|0|0|0|0|0|0|0|857
2 | Cost too much!!! I don't like that I was charged $60.00 for filing taxes and then another $40.00 charge was tacked on for some reason. You charged me $100.00 to do my own taxes and I probably won't be back next year. Cost too much!!!! | 45000000|1|0|0|0|0|0|0|0|0|0|0|0|0|0|858
3 | I hopefully got all my refund.  unsure of refund amount being as high as it could be. | 44999994|0|0|1|0|0|0|0|0|0|0|0|0|0|0|859
1 | Turbo Tax Sucks! Turbo Tax needs to get there act together. I bought the home and small business edition, which is SUPPOSED to come with the state edition yet STILL ended up having to pay $39.99 to get the state and it STILL didn't work! I spent two days and about 5 hours on the phone with customer service just to fix the state return issue. Not cool. Problems with turbo tax each year i've used it...only twice | 44999991|1|0|0|0|0|0|0|0|0|0|0|0|0|0|860
1 | RIPPED ME OFF AND UNABLE TO GET HELP LAST YEAR TURBO TAX CHARGED MY CREDIT CARD FOR THE STATE FILING FEE THEN SENT ME A MESSAGE SAYING I WAS INELIGIBLE TO FILE MY STATE RETURN ELECTRONICALLY. IT TOOK ME TWO HOURS TO FIND A TELEPHONE NUMBER TO CALL. THEN I WAS ON HOLD FOR 2 1/2 HOURS BEFORE THE BATTERY IN MY PHONE DIED. I KEPT GETTING EMAIL REMINDERS TO E-FILE FROM TURBO TAX, BUT REPLYS WENT UNANSWERED. ALTHOUGH I HAVE THE BALANCE OF THE UNUSED FEE PAID LAST YEAR, THEY CHARGED ME AGIAN THIS YEAR. THAT SEEMS DISHONEST TO ME. I WOULD THINK A COMPANY THAT SO MANY PEOPLE RELY ON WOULD MAKE THEIR CUSTOMER SERVICE EASIER TO REACH AND WOULD CREDIT PEOPLE BACK ANY UNEARNED FEES THAT THEY CHARGED. SURELY TURBOTAX MUST MAKE SUFFICIENT MONEY WITHOUT RIPPING OFF ITS CUSTOMERS. CHARGED ME FOR STATE E-FILE THEN SAID NOT ELIGIBLE | 44999986|0|0|0|0|1|0|1|0|0|0|0|0|0|0|861
1 | Disappointed Really disappointed ... I only owed 12.00 ... my deductions doing nothing for me ... your site should run it every different way for best and easiest and cheapest outcome for the customer. It should import all info if you want to try the free or downgrade to any lesser program. I waited till tonight as I only owed 12.00 ... no reason to hurry as I had to pay 30..00 to pay 12.00 ... or so I thought then/now I am paying 54.99 and 12.00 and 3.95 to pay it electronically with my CARD. Sorry so irritated. Will not use this site again. sl not importing info for free file/ and higher charge at end I only owed 12.00 | 44999985|1|0|0|0|0|0|0|0|0|0|0|0|0|0|862
1 |   Our information was used to e-file a fraudulent return through the Turbo tax server. | 44999977|0|0|0|0|0|0|1|0|0|0|0|0|0|0|863
2 | not really free why would you advertise at being free then charge me $30? You tell me I didn't get enough to use the return to pay but still charge me. I'm clearly picking the free option because I can't anything else but I get charged anyway. False advertising, I would rather have someone else do it where I know I'm going to pay than think I don't have to pay & end up being told that I actually do have to pay. even the free option is not free | 44999972|1|0|0|0|0|0|0|0|0|0|0|0|0|0|864
1 | Not Good probably my last year with you all.....sold a MLP and your software could not handle it.....took me weeks to figure out......no use spending money on something that does not work!! Could not handle sale of MLP...... | 44999970|0|0|0|0|0|0|0|1|0|0|0|0|0|0|865
1 | Hidden Fees Bought the turbo deluxe said it was 19.99 to file state, but when filing our second state we had to pay 39.99 to review our second state, Then they charged us 24.99 per state. And then charged us 49.98 to process it. It was 49.99 to buy turbo tax, 39.99 just to see our second state then 24.99 for each state plus 34.99 to process our taxes for a grand total of 174.99 and I could have paid my tax preparer for less than 150. So iI am a dissatisfied customer due to all the extra hidden fees. I will never use turbo tax again. The lies they said about the cost to file | 44999942|1|1|0|0|0|0|0|0|0|0|0|0|0|0|866
2 | Getting less and less from turbotax I have used turbotax about 10 years and I am thinking about find alternative next year. The reason is that Turbotax is getting cheaper and cheaper. And sneakier too. No contact phone. Once you completed printout, you can not make change again. They only have the short version this year instead of the long and short version in previous years. bad customer service | 44999940|1|1|0|1|0|0|0|0|0|0|0|0|0|0|867
3 | good refund  Could have better clarified the tax summary for federal and state that shows how it matches wit the W2 with other info | 44999925|0|0|0|0|0|0|0|0|1|0|0|0|0|0|868
1 | Frustrated and Annoyed I paid 39.99 for my federal tax the I paid 39.99 for the Colorado State tax, on line and then I went to file I had to pay another 24.99. I tried to go on line to ask my question and you wanted another 36.00 to answer my questions. I will NEVER recommend turbo tax or ever use it again. You are a rip off.  | 44999924|1|1|0|0|0|0|0|0|0|0|0|0|0|0|869
3 | Grade, B Paid for a premium product, partly in the belief that the state return was included. It was not. And then the disparity between being told you have all but no chance of an audit and then on the next screen there's a solicitation to be protected. It's misleading, deliberately no doubt. Plus the way Intuit now works with Amazon: how about just keeping to your core competency? And there are still problems with the program, particularly when it comes to fixing errors. Tip: always go to Forms when all else fails. And finally the community was no help.... That's the real problem; I've used this program for a few years and that's always been the case.... Community help is no help; program still has bugs and it can be difficult to track down an error and fix it | 44999920|1|1|0|1|0|0|0|0|0|0|0|0|0|0|870
1 | Not returning customer I have been using Turbotax for almost ten years, but with all of the pushing to upgrade, sneaking in extra fees, and overall disappointment in the system, I will not be a returning customer next tax season. I will be shopping around for a new system. I would have given the experience zero stars if I could. Everything | 44999908|1|1|0|0|0|0|0|0|0|0|0|0|0|0|871
1 |  Even though I said I didn't want to pay the extra $29.99 they charged me anyway and there was no way to fix it. A ripoff!  | 44999907|0|1|0|0|0|0|0|0|0|0|0|0|0|0|872
1 | Absolutely Horrible!!!! I have been using Turbo Tax and Quickbooks for over 20 years and always used the Deluxe version for my personal and small business.
This year to my surprise when trying to file I found that I had to upgrade to Home and Business version to enter my schedule C. After trying the phone number given in the program to upgrade I was told to call after 4/16 which was not an option. I was then hung up on several times. I tried to find answers on the Turbo Tax website and couldn't connect with password and had to have a code no.emailed to me then had to go out of website to get email then when went back to website again couldn't enter with out code. Had to have my son get his computer to have 2 computers to enter website and found no answers or help there either.
Finally called the Intuit number and had to go through bunch of recordings to finally be told I would receive a call back. I waited hours for the call back and was given a conformation that didn't work. I went through this several times before I finally got a person the next day to stay on the line to get my upgrade.
After all this I had to buy an additional state and again wasn't able to online and had to call Intuit again same senario and wait hours for a call back to buy the additional state and get a conformation.
Then when I tried to efile it wouldn't let me online again and I was forced to pay an extra $39. to have the charges deducted from my refund because it was too late to call and wait hours again for another conformation.
This is ABSOLUTELY the worst experience I have had in over 20 years as a loyal Turbo Tax customer and I will probably change to another tax software company next year. Everything | 44999905|1|1|0|1|0|0|0|1|0|0|0|0|0|0|873
3 | Frown Made it so difficult to not upgrade that I ended up paying the additional $29.99 because I couldn't figure out how not to Extra Fees | 44999901|1|1|0|0|0|0|0|0|0|0|0|0|0|0|874
2 | Paid too much I was suppose to get the one time rate of $29.99 for DELUXE- which was great! However, I started over, switched to the FREE edition then ended up switching back to DELUXE. Be careful because ONE TIME rate...really means ONE TIME. That doosy cost me $25. Oh well...you live and you learn. paid too much | 44999895|1|1|0|0|0|0|0|0|0|0|0|0|0|0|875
1 | suck you advertise 5 federals and one state for free. I go to file state and you get me for $25, after I paid $60 up front. Bull S**t. I'll find an alternative next year, after more than a decade of paying for and enjoying your service-no more surprise charges | 44999894|1|1|0|0|0|0|0|0|0|0|0|0|0|0|876
1 | Regret Using Turbo The pricing posted was false. There was no one to contact to fix the situation. Next year I will be using H&R block or a different online service.
Customer service should be key and it doesnt seem to be with this site. The free advertisements are a joke. Total waste of time and money, Ill be sure to recommend everybody elsewhere. I didnt like the process. No one could be reached and the pricing was inaccurate | 44999889|1|1|0|0|0|0|0|0|0|0|0|0|0|0|877
2 | Too many advertisements for other products This system was nice and fast. However, it constantly had buttons to upgrade to different platforms that cost money to file state returns, etc. This was so distracting and annoying -- I ended up spending an hour filling out information on my state returns when I got to the end and had to cancel them because the only option to submit them was to pay a fee. Very misleading / a waste of time. too many "buy this" or "upgrade" buttons | 44999865|1|1|0|0|0|0|0|1|0|0|0|0|0|0|878
1 | Scam First you select to do a free federal return, and at some point, the software is supposed to inform you if you will be switched to the pay option due to (I'm guessing here because I still don't know...the software is THAT bad) itemizing. However, that never happened. Then, when it was time to complete the return, suddenly, you have to pay. No notification before hand. You try to switch to the free return, but it you can't. The only options you have are to pay or start over. And the tool tip has text on top of text, so, of course, you can't read it. I think that's done on purpose to frustrate customers who have already spent time filling out the forms. Who wants to start over after that? Probably no one. Turbo Tax knows this, and they know that you'll just go ahead and pay. It's a scam, and it's pathetic. The acquisition of the all-mighty dollar is goal here even if you have to misdirect and fool customers into obtaining it. Sadly, Turbo Tax has sunk to the bottom of the barrel with tactics such as this, and we will no longer be using their services...ever. You should be ashamed of yourselves. Does these reviews go to a public forum? If so, I seriously doubt this one will make it there. The company doesn't want people to know how it scams customers, but at least the person who does read this and decides to prevent it from being public knowledge will know what a pathetic company he/she works for. Making money is the focus, period | 44999860|1|1|0|0|0|0|0|0|0|0|0|0|0|0|879
1 | Horrible! I am eligible to file for free yet could not with Turbo Tax despite spending many hours completing. Went to site for free filing, said turbo tax was an option, went to turbo tax and had to pay full price. Will not be using Turbo Tax next year. Not user friendly at all! free tax filing, NOT | 44999845|1|0|0|0|0|0|0|0|0|0|0|0|0|0|880
2 | Got charged for Free State e File I got a message that I had to pay to efile the State Return but there was supposed to be one free State efilling with my purchase of TurboTax. I trid to contact TurboTax support but no luck so far.... maybe I can resolve tomorrow. I went ahead and paid now so I coudl file and will ask for a refun or not to be charged tomorrow, April 16th.  | 44999842|1|1|0|0|1|0|0|0|0|0|0|0|0|0|881
3 |  Not as easy as prior years.
With problems that the software had this year, felt I needed to check the calculations

Suggest offering a brief of the major statutory changes up front that people could watch or work through before beginning taxes. Then surprises of all the additional taxes, treatments, etc will be lessened. Did not make me aware of all the tax changes up front/ had to laboriously go through worksheets to ensure it was correct | 44999837|0|0|0|0|0|0|0|1|0|0|0|0|0|0|882
