3 | Extra costs The box isn't clear when it describes what's included in a package. I didn't like their offering "add ons" while I was completing my return. I had to upgrade which cost much more than if I had purchased that set to start with. Then by the time I paid for e-filing the state return, I could have hired someone to do the taxes for me for less. I'll either use a cheaper brand next year or will hire it done. extra costs all over the place | 45454500|1|0|0|0|0|0|0|0|0|0|0|0|0|0|0
3 | Extra costs The box isn't clear when it describes what's included in a package. I didn't like their offering "add ons" while I was completing my return. I had to upgrade which cost much more than if I had purchased that set to start with. Then by the time I paid for e-filing the state return, I could have hired someone to do the taxes for me for less. I'll either use a cheaper brand next year or will hire it done. extra costs all over the place | 45454500|1|0|0|0|0|0|0|1|0|0|0|0|0|0|0
2 | Used to be good Had to go back through parts of federal (continue, continue, continue, continue, continue) and ALL of state, TWICE (continue...) to get TT 2014 to accept my return for submission. The "errors" it was looping on were "missing data" in fields that were supposed to be ZEROS. Even the online help indicated that others had the same struggle, but the "reply" from TT was useless. Errors put me in loop, but it wasn't MY error - it was TurboTax! | 45454051|0|0|0|0|0|0|0|1|0|0|0|0|0|0|1
2 | What a grind! Investment income. Stock sale. You do not have a catagory for long term sale of asset with no cost available. Item box x on 1099 Div says should be moved to box E. IRS says move to box E. TT says there is an error that entry MUST have a cost. Since cost not available, and if put in Box, it would be taxed as a short term gain, your programmers have made an error. Spent off and on over an hour with your tech support.

Your final final review says all fixed, you can file it, but when I go to print it it says I STILL have errors!!! Too many ads.

You have removed option to opt out of upgrading by making certain forms very difficult to find. YOU MUST leave me an option to NOT UPGRADE. I used to be able to do ALL forms with the basic version. Sorry I got the homeowners deluxe version. IF I have to do have of the form in form view, why should I buy it at all?

Car page. I did NOT enter any expenses for an auto this year, but had to go thru the nonsense of filling out the form. Why not a box to check that says "No car expenses this year?" And then not have to fill in forms that will be blank.

Called phone number on website for Turbo Tax and got the voice mail of a person out on maternity leave. No other option. Had to search entire site to get ahold of cust service. I est. it took me nearly 15 minutes to locate a phone number that worked.

I have been using TT since 1990. You change the order of questions too often. Why not have a check list of the questions that you will ask so we can fill in the answers BEFORE we start the actual return..Ties up the computer and takes hours to complete a return.

Why is it a BIG DEAL to choose a nickname?? So what if there are more than one John Does? You honestly think I'm going to give you something I don't like just to satisfy your computer??? Your review just went down two more stars over the ddd nickname thing. Errors again in TT | 45453489|0|0|1|1|0|0|0|0|1|0|0|0|0|0|2
1 | Poor service 2014 This is the first year that I would say I would not use Turbo Tax again. Why pay for automative services when you can not e-file! I has been a waste of $188.45. Lack of service | 45451898|1|0|0|1|0|0|0|0|0|0|0|0|0|0|3
3 | Great Federal. Disliked State Overall the Federal filing was very straight forward for filing jointly. My problem came from my wife and I working in separate states and the requirement to file separately. The process is complex to perform and the secondary tax payer cannot efile and has to mail their forms in stating security as the reason. I ultimately had to create 3 turbotax files to complete. It would seem that you should be able to be able to do it all within one file. using separate files made it very challenging when looking at which items are separated so you are not double taxed. I will probably have to have my state returns reviewed/amended by a professional. poorly done for people filing in multiple states | 45451623|0|0|0|0|1|0|1|0|0|0|0|0|0|0|4
2 | Too Many Bugs I itemize. In the Other Deductions & Credits category, $15k of "Other Deductions" was automatically being entered from nowhere. After paying and downloading for 2014 Premier I still had the problem. My son's Federal return has now been rejected twice for the wrong ePIN, and now the tax filing is late! Really .... really perturbed (pst) off now! Starting to lose faith in TurboTax. Quality of product seems to be waning. Incorrect data appears | 45451247|0|0|1|0|0|0|0|1|0|0|0|0|0|0|5
1 | Did not allow me to efile state return  This year Turbo Tax would not allow me to file my Maryland state return. Fee for state filing too much | 45450445|1|0|0|0|1|0|1|0|0|0|0|0|0|0|6
3 |    | 45449220|0|0|0|0|0|0|0|0|0|0|0|0|1|0|7
1 | THIS PROGRAM IS WORTHLESS I can't get the program to work. I need to send in an amended form for my federal and a printed form for my state. I follow the instructions and hit a dead end for filing the amended form. I never could print any copies other than electronic ones. This messed me up with my state form and they are now on my case to file. I have used Turbo Tax for years....NEVER AGAIN The 2015 version is a nigtmare | 45445146|0|0|0|0|1|0|1|0|0|0|0|0|0|0|8
1 | E-FIle I went through all of the steps to file my taxes. I aded my AGI and paid for the program and realized 15 days later that nothing was submitted. Now I have to pay penalties and late charges to the IRS because of Turbotax's failure to submit. I will never use this program again. In the end, I was charged another 1,000 on top of the 2137.00 I already owe to the IRS for a mistake that I was not at fault for. Program malfunction | 45435209|0|0|1|0|0|0|0|0|0|0|0|0|0|0|9
1 |  I filed my returns on 4/15. came back to your site today as i hadn't received my NY STate refund and your site said there were NEVER sent ?
What the heck ? Been using your service for years, but not next year. Incredibly disappointed at this snafu as i KNOW if hit the send button and actually mailed the checks to pay after printing everything out.
WHY WOULDNT YOU SEND ME SOME TYPE OF NOTICE IF I PAID, PRINTED EVERYTHING OUT AND DID EVERYTHING EXCEPT SEND THEM IN DIGITALLY ? REALLY ??????
MANY COMPLIANED ABOUT YOUR SERVICE THIS YEAR. I AM NOW ONE OF THEM. THIS WAS HORRIBLE SHAME ON YOU  | 45432107|0|0|1|0|0|0|0|0|0|0|0|0|0|0|10
2 |  Continuing the DE error - your package does not permit me to change the status of non-DE municipal bond income from tax-free to taxable. Also, the pricing fiasco you pulled on us was extremely disheartening. No alert for when I thought I filed but apparently had not pressed the last button. The state form for DE has an error. | 45430195|1|0|1|0|0|0|0|1|0|0|0|0|0|0|11
2 | Was great ... last year I needed to fix my return. In the past, whenever this happened TurboTax took to right to the place I needed to go. This time it simply told me to open my form 8965 and fix it. I could not find any way to open this form.
So I went to customer support. They said they would call me back in 60 minutes. It said to call back if no one calls in 60 minutes. The page also included a number to call. It was not clear that I was suppose to call first to get in the queue, so I wasted 90 minutes waiting for a call which was never coming.
After I called back and got in the queue, I waited for another 150% of the quoted wait time. Still no call back. I called again and got put back in the queue again. Shortly there after, I got a call back, the agent didn't know how to open the form, only how to delete it.
After finally getting everything fixed, I got another call back (from the final time I had called them). They didn't know they had already talked to me. Their new customer service system is worse that the Obama Care web page for all the problems it has. I'll give them another chance next year to see if they can get back to their old glory, otherwise, I'll be looking for new tax software. ... Only not this year | 45428321|0|0|0|1|0|0|0|1|0|0|0|0|0|0|12
1 | Not worth the higher price this year I think it is pathetic you require the purchase of Home and Business software simply to be able to file a schedule C on an otherwise fairly simple return. I will look elsewhere next year and get an earlier start. Held captive to use ridiculously inflated program the next year | 45428106|1|0|0|0|0|0|0|0|0|0|0|0|0|0|13
1 | worst experience there was too many changes to the software this year. I still havent been able to complete my state tax return even though when i purchased the software it said I was supposed to get one state return free. Turbotax is a rip off too any changes | 45428032|0|0|0|0|1|0|0|0|0|0|0|0|0|0|14
1 |  I ordered Mac version. You sent PC version. I want a refund.  | 45427958|1|0|0|0|0|0|0|0|0|0|0|0|0|0|15
1 | Not as good as I was told. I paid newly 60 dollars to have all my returns done, two of which I has to print out and mail in anyways, AND my federal keeps getting rejected when nobody I know has used my social on their taxes for that reason. NEARLY FIVE TIMES I'VE BEEN REJECTED SO FAR WITH NO INFORMATION PAST THAT IT ISN'T GONG THROUGH EXCEPT FOR MY SOCAL POSSIBLY BEING USED ON SOMEBODY ELSE'S TAXES. THIS IS THE ONLY REASONING I'VE GOTTEN AND IT'S OVERLY AGGRAVATING BECAUSE NOBODY'S USED ME. Returns have been rejected too many times for my liking and have yet to be accepted. | 45427867|1|0|1|0|0|0|1|0|0|0|0|0|0|0|16
1 | Bad Changes you have changed your product for the worst. it is unclear at points within the software, and not set up the same way in its installation - ie: one cannot open the program from the short cut and reach the file in progress. there are other awkward transitions and cloudy issues and directions. I have been a Turbo Tax user for about 10 years, and this will be my last. you have taken a good product and made it bad. even your insistence on using a "nick" name on this review is stupid. Terrible overall changes | 45427293|0|0|0|0|0|0|0|1|1|0|0|0|0|0|17
1 | Could not enter Wis non-res tax withheld Until this year I was a delighted TurboTax user. This year, I did not like the new format and would suggest offering former users the option of sticking with the old format - at least during a transition year. The new format on Premier was not transparent - I could not go to forms when needed to check specific items.Worst of all, despite hours of effort using desktop TurboTax Premier version ($85), I Could not enter Wis non-res tax withheld. After more than 6 hours of trying on my own and then a cordial 45 min phone discussion with your TurboTax on expert, the issue still went unresolved. This caused me to have to file for an extension for all of my taxes - not ideal, to say the least. Your person said he rebatted my $85 and told me to get TurboTax Delux were I could see the forms. So I then had to buy TurboTax Delux - at least that offered the forms option - where, by myself, I figured out how to sidestep Turbotax automated system (by going directly to the forms and searching out the place for withholding - not at all evident - another 30 mins wasted) to finally get credit for my Wis non res tax withheld on my Wis tax form. Next year, if I don't switch to another brand, I will buy TurboTaxDelux I guess because of the bug in TT Premier. I don't understand this oversight by TurboTax. It cost me hours and hours of wasted, frustrating time. Not a happy camper here at all. I finally did get my taxes in. Could not enter Wis non-res tax withheld; do not like new format in general | 45427267|1|0|0|0|0|0|0|1|0|0|0|0|0|0|18
1 |    | 45427011|0|0|0|0|0|0|0|0|0|0|0|0|1|0|19
2 |  I have used Turbo Tax for about 15+ years while completing taxes for my family and friends. This year was very frustrating. I was unable to download my free state or purchase an additional state. I was also unable to e-file any returns. I spent over three hours on the phone with your techs to download the free state, purchase the additional state and to e-file one return.

Your techs were very patient, professional and knowledgeable.

However, I will not be using your product next year.

D. Walker  | 45426344|0|0|0|0|0|0|0|0|0|0|0|0|1|0|20
3 | too expensive Good expert support. He fixed the problem. I had to pay an additional $30 to get the program that included investments. This is a rip-off. I had to go to expert support to fix a problem in turbo tax | 45425737|1|0|0|0|0|0|0|0|0|0|0|0|0|0|21
2 | This program has gone down hill I have been a loyal user of Turbo Tax since it was a DOS based program. Well I think NO MORE!!!.

It used to be Deluxe did everything.
Then I had to upgrade to Premier because I sold stocks.
Now I have to upgrade to home and business to do a very simple schedule C.
Price goes up and functionality goes down.

Now I could live with some of this. But now all the help does is take you to the user forums - no real help available.
The functionality for dealing with K-1s is broken especially when a disposition is involved.
It is harder and harder to find where data comes from and how it is populated.

I will be trying one of the other programs next year. Increase in cost, requiring higher versions for basic stuff, NO HELP worth using | 45425637|1|0|0|0|0|0|0|1|1|0|0|0|0|0|22
1 | Error Code R0000-902-01 I received an error code. R0000-902-01 That appears as if my taxes have already been filed. I had not file them prior to doing in on your site 4/15/15 I went online to the IRS site and set up an account to check. They haven't received anything as of 4/16

I am not sure if perhaps the TurboTax electronic transaction has triggered this error.

Please advise as I need to remedy this immediately or file for an extension if possible. This year i received an error. Now late although filed electronically | 45425297|0|0|1|0|0|0|0|0|0|0|0|0|0|0|23
2 | Liars The whole time I pressed the free buttons I did NOT. Want to pay but somehow at the end you guys make it seem like its free then I owed 100$ I wouldn't recommend to anyone u guys are liars Con you into buying | 45424758|1|0|0|0|0|0|0|0|0|0|0|0|0|0|24
3 | Glad you came to your senses The initial release of TurboTax Deluxe did not include, as it has in all the previous years I used TurboTax, the section for figuring interest, dividends and I believe Schedule B, leaving me perplexed and frustrated with the obvious manipulation to "get more money."

Fortunately, that was changed before I totally switched away from TurboTax. I felt that was very underhanded and "money driven," just trying to get us to pay more for less service.

Other than that, the program works quite well. Thank you. Sometimes does not fully explain problems when smart check shows an area to be fixed | 45424092|1|0|0|0|0|0|0|0|0|0|0|0|0|0|25
1 | ok 2015 e file had to pay for certain stuff, asked to upgrade to many times and gotten strict with after i did not upgrade and even tho i seen my neighbor file and it did not ask her to pay 29.95 for state it was included for free and asked me for a pin when it never for my neighbor its really a bad idea to file this way upgrades, pay for services and not up to date electronicaly | 45423637|1|0|0|0|0|0|0|0|0|0|0|0|0|0|26
3 |  I hope that there will come a time when it will only take one hour or less to file a return,not the nearly six hours I spent. in the past turbo delux covered investment reporting, . In many spots the process is very confusing. | 45421126|1|0|0|0|0|0|0|0|1|0|0|0|0|0|27
1 |  Apparently, our return that was finished on Turbo Tax on April 13 was never actually e-filed. This is just one-more instance where we found the Turbo-Tax process to be much too complicated.

Another example that I just encountered: trying to get an acceptable nickname! Too, Too compluicated | 45413563|0|0|1|0|0|0|0|1|0|0|0|0|0|0|28
3 | Annoyed about e-File I find it annoying that some of the labeling is misleading. In the VA state return one of the deduction items lists "VA Prepaid College Tuition Plan". But you have to click into the category to find out that this is ALSO where REGULAR 529 payments are put, which have NOTHING to do with prepaid tuition plans. Irritating. This kind of thing happened a few times in the Fed return as well. Why would I want to go down the "Prepaid" path if I do not have a "prepaid" plan? Well, turns out I freakin' had to. Why not just say ALL 529 plans??? That IS what it was, after all.

Next, for the IRAs, why not ask me if I want TT to solve for the max IRA I can have, then let me tweak it? Instead I have to tell it how much I theoretically put in, and then jump through all of the freakin' hoops to then find out I don't qualify for that much, or that I cannot do a Roth, or only part can go into a Roth. C'mon Intuit, you can't ask if I have a Roth and a traditional IRA, then solve for me how much I can set aside, THEN ask the amount? You cannot do that right there in the Q&A as I waltz through the program?? Hire better programmers.

Next, I am especially ticked off that I cannot e-file my state return after I have e-filed my Fed return. In VA, the state return is not due until May 1, and the day I did my Fed return I did not feel like slogging through the state as well. I did not see ANYWHERE a warning that I would not be able to e-file the state return later. This TORQUES ME OFF! In 2015 I can dump my tax returns up to your cloud, but Turbo Tax isn't smart enough to keep track of the fact that I already e-filed the Fed return???? Why??? Gimme a break, you guys! I'm a long time TT user, but this could push me to Klipinger or the like. And I pay for the Home and Business edition, which costs me a hundred bucks each year. For that I cannot at least have the option to e-file my state taxes LATER, WHEN THEY ARE ACTUALLY DUE??!!! Very annoying.

Gotta say this may have been the worst experience I have had with TT, and I have been using it for more than a decade. Too many misleading labels; cannot e-file state return if Fed return already e-filed | 45411552|0|0|1|0|1|0|1|1|0|0|0|0|0|0|29
1 | Disapointed I have not received my return check because my SS# was used. I got a police report and mailed to IRS, they finally stated that they would send my return. I am still waiting. Not happy at all that I have had to go through so much. Not a happy camper at all. My return was done early in March and I have not received my return yet. My Social Security # was comprimised . | 45411272|0|0|0|0|0|0|1|0|0|0|0|0|0|0|30
2 | Good Concept This was my first time using it. When submitting and paying by Visa, it looked like it was filed and I was finished. I became concerned when I checked on why my state tax was not deducted and found out my return was NOT submitted before the April 15 deadline.
Why is there not an email sent out alerting me? Now I will have to pay penalties even though I filed a week Before the deadline.
My Turbo Tax firms stayed in limbo and I had no way of knowing this!
I am Very upset about this! See my review please | 45411215|0|0|1|0|0|0|0|0|0|0|0|0|0|0|31
3 | 70good returns I am having problems with my e-mail and have not had access to my account. I think it would be easier if I felt more comfortable with the computer. And had access to my e-mail. I hopefully will have a better experience next time. Thanks difficult to access areas difficult for someone who is not good on conputers | 45410730|0|0|0|0|0|0|0|0|0|0|0|0|1|0|32
3 | Frustrated I thought my tax return had been sent weeks ago, only to find out that something wasn't right and the return had not gone through....which makes my return late. The system is not clear about the final process | 45409786|0|0|1|0|0|0|0|0|0|0|0|0|0|0|33
1 | turbotax handling of nonresident state is horrible Did my federal + NJ with no issues, then got a K-1 from an estate and had to do a non-resident form for NY, and that was a disaster from the start. It did not correctly transfer in simple stuff like the taxpayer info and the tax year from the federal form into the NY taxpayer info form.
So then it was asking questions like "did blank have any income in tax year blank"; was especially bad if you had to pick who something belonged to and both choices for names were blank.
So I switch to forms, and it says there are errors with the NY taxpayer info form so I fill it in manually; that gets rid of the error, but really doesn't seem to fix the issues.
But I make it thru everything, all the error checking and audits, and go to file, pay for filing and get to the absolute last step of clicking on the button to transmit the returns
AND THEN it complains you can't fill in the info in the NY taxpayer info form, it has to be imported.
SO WHY DOES IT WAIT UNTIL THEN TO CHECK THAT???
So I go back and remove the info I filled in,
and then it complains that it is missing again.
So I go back to federal and walk thru everything again,
go back to NJ and walk thru everything again,
go back to NY and walk thru everything again;
Luckily going thru everything a second time seems to have
made it import the Federal taxpayer info into NY,
and now I can file.

I'm seriously going to look at other tax programs next year.
Especially after having to pay $39.95 for a second state!
That's crazy. nonresident state was a disaster | 45409756|1|0|0|0|0|0|0|1|1|0|0|0|0|0|34
1 | turbo tax is confused I have used turbo tax for years, but wont again. the software got stuck and could not provide me solutions for its questions. the software also indicated that my taxes had been files, I have a printed copy of the statement but the taxes were not filed so now we are paying penalties and interest. the dang software gets stuck and provide no help on how to solve issues | 45409133|0|0|0|0|0|0|0|1|1|0|0|0|0|0|35
1 |    | 45408437|0|0|0|0|0|0|0|0|0|0|0|0|1|0|36
2 | My refund was never filed....??? Now - my taxes are late - how did this happen? I got a clear indication that they were filed. I cannot believe that these were never sent. This years taxes never got filed although I did get charged on my credit card for the state | 45408117|0|0|1|0|1|0|0|0|0|0|0|0|0|0|37
2 |    | 45407742|0|0|0|0|0|0|0|0|0|0|0|0|1|0|38
2 | Thought I was done!!! Was not!!! I thought my taxes were done even mailed in my payment. Turns out they were not done and now I'm a month late! I just happened to check back because I had a bad feeling that they were not done even though I recieved a congratulations on completing the process!!! I'm very disappointed and angry about this situation. I thought I filed in time and turns out my return was not complete. They were not complete, now I'm late!!! | 45350832|0|0|1|0|0|0|0|0|0|0|0|0|0|0|39
1 | turbo tax Support is the worst. advertises being able to contact customer service, but even with the software they make it almost impossible to find a phone number and will always redirect to web page with input only from customers (and not usually applicable to your situation). software has not transfered from previous years (for the past 5 years) as they advertise (and of course you can't get customer service). they are always trying to upsell more services to maximize their $ and delete parts of the software to force you to buy more expensive versions. have been using turbo tax for 15 years and almost every year finish with a bad taste about it. since it doesn't transfer anyway and with no customer service, next year for sure i will try a different software. It's just how they treat loyal customers. does not transfere from past years(5), will always try to upsell. | 45350195|0|0|0|1|0|0|0|0|0|0|0|0|0|0|40
3 | Turbo Tax review  brings data in from other sites | 45350187|0|0|0|0|0|0|0|0|0|0|0|0|1|0|41
2 | Turbo Tax Chaos The software is great - Your trying to sneak in a price increase by charging for a schedule C without notifying purchaser was smarmy at best - I've lost trust in TurboTax and will look elsewhere next year for my tax prep software - I have used TurboTax since at least 2009, and maybe before. I have a funny feeling next year will be rough for TurboTax $50 and no Schedule C? Credit for Schedule C if you fill out this form? Later purchasers get Schedule C for free? | 45349923|1|0|0|0|0|0|0|0|0|0|0|0|0|0|42
1 | Put the screws to us I will never use this again. I have used this for the last several years and last year I bought the program and ended up paying twice as much. This year we are screwed because I printed the return witch has always been the last step, but this year when I printed the return the site closed and charged me more than last year now I find out it didn't send. this is wrong didn't file | 45349525|1|0|1|0|0|0|0|0|0|0|0|0|0|0|43
3 | Slow support Departments do not coordinate information if you need help. I spent a total of 150 minutes and on hold while transferred 5 times before I got someone who could answer my question. Non-existent customer service | 45347811|0|0|0|1|0|0|0|0|0|0|0|0|0|0|44
3 | Disappointed for the first time! For the first time -- after using TT for more than a decade -- I had significant concerns with the product.

1) I was almost done with everything (using TT Deluxe as always) when I tried to enter my K-1 information and was forced to pay $24.99 to upgrade to Premier. As a regular, long-term customer, you should have had some way to lest me know about this product change other than a last-minute surprise.

