3 | Frustrated with the 2014 Premier edition I was very frustrated this year with this version of TurboTax. In the 30+ years that I have been using TurboTax, I have never had so much trouble in entering my data and having it transfer properly. Especially had difficulty with Its Deductible and importing the data.
The extra info that Form 8283 required was just about impossible to correct. Also, all overrides came up as errors but only because you apparently can't use overrides if you are filing electronically. There should be a question about filing electronically - I think there was one near the end of completing info. If you answer NO then overrides should not continue to come up as errors. They could be shown once to give the preparer the opportunity to correct them.
My federal return claimed numerous errors - they were all related to overrides concerning my non-cash charitable contributions. The overrides were the only way that I could get the info required onto the 8283 form.
Your program showed those errors on the review of the Federal tax return and again on the final review after completing my State tax return. Also, when the mention of errors comes up the only option is to review the errors - you can't say to skip them.
I took the time nearly at every place I was having problems to give feedback naming the location and explaining my problem. On your feedback requested I could not tell if the page or screen view that I was on would be known to you.
Having said all this, I have used your program for I think over 30+ years, with very few problems. I remember that the first year that I used It was a wonderful experience. My returns have grown more complicated. This is the first time that I have had major problems with your program. I hope that my comments will help you improve your program for 2015. Info ($ amounts mostly) did not transfer with correct amount and difficult to correct returns. | 45043230|0|0|0|0|0|0|0|1|1|0|0|0|0|0|313
3 | Mr Fernandez I liked the online service but seriously I would stick to the software. I can do more taxes from family members and the online service is only for one person. The software is 80 dlls and the online service was 185 .. big difference Start with free then the add on gets a little bit pricey | 45043000|1|0|0|0|0|0|0|0|0|0|0|0|0|0|314
2 | Did not handle stock trades well Very poor and inadequate handling of wash sales, short sales or stock trades multiple brokers. I had to buy another software program and figure out how to integrate those forms with TurboTax. This has been going on for years with TurboTax. Inexcusable. Handled stocks poorly. | 45042962|0|0|0|0|0|0|0|1|0|0|0|0|0|0|315
3 | Turbo Tax Deductions and Homeowners Deluxe Your steps to fix return did not work in my case. Only errors that showed up were related to when to withdraw money to pay my taxes! Because your program created errors on my return. If you cost me a penalty I will be very angry. Impossible to fix errors on forms. I don't know wheere to go or how to get there. My Federal return has been rejected | 45042903|0|0|1|0|0|0|0|1|1|0|0|0|0|0|316
3 | Can't be any more complex An example of my annoyance. With foreign income, the software accepts a certain types of entry for state, zip code, employer's Id etc which have to be fictitious. As for example, UK does not have 'states', 'zip codes' and banks there do not have 'ID recognized by IRS'. But having accepted certain 'fake' entries (suggested by your experts) it shows up those as errors and makes it impossible to satisfy the software and reach the end for filing. It is downright stupid and wastage of my valuable time to sort out. Ask you software guys to change the program to make it remember the entries accepted during the main preparation and not to flag those as errors at the end. What is the use of using this software if the program is so dumb and does not help the poor tax preparer to overcome this problem not of his creation? Very unfortunate. Very long winded. Childish way to direct the tax preparation with pictures of experts - serves no purpose. | 45042889|0|0|0|0|1|0|0|1|0|0|0|0|0|0|317
2 | No discount Signed up with my employer, due to was promissed discount. However after completing tax returnes was charged full price and no discount were given. confusing how to input ssi income | 45042633|1|0|0|0|0|0|0|1|0|0|0|0|0|0|318
3 | Great Software...couple of glitches If you list your home office business use as less than 100%, the TurboTax worksheet for IRS Form 8829 incorrectly calculates the depreciation limit and makes the allowable depreciation artificially low by not allowing the full net income from your schedule C, plus or minus appropriate adjustments. TTax calculation worksheet needs to be rewritten for this to correctly calculate the allowable depreciation limit for the home office deduction. Turbo tax will NOT allow you to efile your taxes if you make any manual override corrections on any of the tax forms, so I could not initially efile my taxes and had to get a tax professional to efile an extension request (because Turbo Tax will not even allow efiling an extension request if you have an entry that is manually overridden on a tax form)-- VERY FRUSTRATING! Otherwise, I've had pretty good success with the software, other than a couple of times where the data from a correction did not carry through to make corrections on all necessary data fields, until I went back through and figured another way to work through the problem and get it fixed. Home Office Deduction section has glitches/errors, in some cases. | 45042044|0|0|0|0|0|0|1|0|0|0|0|0|0|0|319
3 |    | 45041929|0|0|0|0|0|0|0|0|0|0|0|0|1|0|320
2 |    | 45041923|0|0|0|0|0|0|0|0|0|0|0|0|1|0|321
1 | HORRIBLE use H&R way better! filed for years using TT & H&R had a rejection from H&R was easy to fix. This year TT Rejected 5 times not clear why still rejected and says better to mail then I shouldnt have paid to file as federal was free you pay for state. I think H&R next year and recommend using H&R. when rejected not clear on fix | 45041811|0|0|1|0|1|0|0|0|0|0|0|0|0|0|322
3 | Next year may need something more expen$ive TT Deluxe used to do everything I needed. Standard forms 1040, Sch ABCD. It asked me to upgrade to premier for rental and stocks? Deluxe used to handle it just fine. Good thing people complained, and I got the free upgrade after patching TT. I'll be checking a little closer next year, because I know it will cost closer to $100, instead of $50. Nickel and Dimed for the upgrades. | 45041762|1|0|0|0|0|0|0|0|0|0|0|0|0|0|323
1 | Not happy I was very disappointed. Previously I bought turbotax and downloaded CD to my computer. This way you payed for federal return and got a free state return. This year I decided to prepare my taxes on line and after I filled out everything I was charged for both federal and state returns even though I could not e-file state. My only options were to pay and file or erase all information put into my state return and begin over. I will not do this again and probably won't use turbotax next year because of this.

I have used TurboTax for several years but I was very dissatisfied this year. Was charged extra fee for state but was unable to e-file. | 45041691|0|0|0|0|1|1|1|0|0|0|0|0|0|0|324
1 | Hidden fees - Will never use again After spending almost 2 hours getting everything in the tax form, they say I HAVE to upgrade and pay $55 to submit. I reluctantly agree, then they add a $35 transfer fee for my depost. It's a bunch of BS and I'll never use this service again. Added $90+ worth of fees at end | 45041576|1|0|0|0|0|1|0|0|0|0|0|0|0|0|325
1 | Disappointed I'm a big fan of TurboTax. I've been using it for decades. Once you start using it it's easy to get "hooked" because you get familiar with the process (i.e. the software), and also it "auto populates" a lot of your data from the previous year which makes it easier to fill out the forms, and provides automatic current-to-previous year comparisons.

Now the bad news.
(1) The software "auto-populated" my AGI from 2013 as a means of identifying me and doing the electronic signature at the end of the return, right before filing. It entered the wrong number, and my return got rejected. I did not check the number before filing because I have learned to trust the software to get it right. If you can't trust your tax software to do math right, and move data between locations, what can you trust?
(2) I chose to NOT e-file a State return. TurboTax's instructions for paper filing a State return were lousy. They gave the impression of being intentionally confusing. I can only presume the intention because their instructions everywhere else are quite clear. Are they trying to drive business to e-filing state in order to collect the $25 fee?
(3) A mailing address in the State return instructions was wrong. Fortunately I caught it by reading the State return before mailing.

I will use TurboTax again, but it should be better than this by now. These problems are bush league stuff. The 2014 version had at least one bug, and one intentionally imposed difficulty.. | 45041503|0|0|0|0|1|0|0|1|0|0|0|0|0|0|326
1 |  H&R block is a way better product and has more support. I will be returning to their product next year.  | 45041469|0|0|0|1|0|0|0|0|0|0|0|0|0|0|327
3 | Well, not so sure I did my taxes on April 135h, then found they had not filed. So I refiled on April 17th and both Fed and state were rejected. They said the Payer's Federal ID numbers were wrong. So I rechecked my print out and found I had the right ID numbers. What happened? I don't know. Anyway, I am refiling now.  | 45041442|0|0|1|0|0|0|0|1|0|0|0|0|0|0|328
2 | really you force to have the business now Maybe it is time to start looking at other options. I can have a professional prepare my taxes and file them for what it cost to buy turbotax and pay the state e-file.

I think turbotax is is over stepping it's value and I would not recommend anyone not using turbotax to start! For those of us that have used it... well it depends how painful it is. cost | 45041359|1|0|0|0|0|0|1|0|0|0|0|0|0|0|329
2 | Disapointment this year Needed upgrade and was charged, auto upgrade did not work, so needed a person to person exchange which took extra time(she was great and helpful), 2014 did not pull data from 2013 so had to type all data again, why not put up an outline of areas to be covered and catagory so I could organize data ahead of time? Bought Delux as always, and needed to upgrade to Premium. Costco promised a free upgrade after 7/Feb and was charged f | 45040663|1|0|0|0|0|1|0|0|0|0|0|0|0|0|330
1 | Return turbotax user, will never use again! All I can say is turbo tax quality has steadily declined in quality and important information. Last year I had to file an amended return because turbo tax missed an $8000.00 deduction. This year an error in e-filing my returns resulted in several hours of frustrating time spent following their online instructions trying resolve the issue. The final snag was when they told me to call their customer service but failed to furnish a telephone number.
After another delay I finally was given an Incident ID # and a phone number. After receiving a call back from Jam, who was a big help, the problem was finally resolved. THANK YOU JAN! Doesn't include include major state deductions | 45039704|0|0|0|1|1|0|0|1|0|0|0|0|0|0|331
2 | Removed All of the Data I had to redo my taxes THREE times because your TurboTax Premier Program kept removing the data that I had entered.
I would save after I finished entering my data and later when I tried to open the program I would get the Program but there would be NO DATA..
Also, in previous years it was much easier to check where the entries came from by double clicking on an entry.Not so much now. I miss the IRS instructions that used to be included in the Program. Used to be much more user frindly | 45039124|0|0|0|0|0|1|0|1|0|0|0|0|0|0|332
2 | Have always been a fan but......+ Have heard of other people's tax returns unable to file do to duplicate SSN. I am in the process of investigating but if the problem points to Turbo Tax- will NOT be using again and will be talking to others telling them of my experience. If I find out that it was NOT a Turbo Tax issue then will continue to use. Further investigating is pending. Maybe a 5 star rating is coming but not yet. when I went to e-file- said there was another return already submitted with my SSN. | 45039088|0|0|0|0|0|0|1|0|0|0|0|0|0|0|333
1 | completely screwed up electronic filing Electronic filing for state and federal did not go thru. Email from TurboTax said go back and we'll show you how to fix it. Went back. Tried online address for IRS they gave, It repeatedly said, "You cannot apply online for pin." Then I tried phone number for IRS, seven times over three days. It never got past entering the birthdate before it hung up. Went back to Turbo Tax after each of these. No contact person, no one to talk to, just referred me to online forums. Then tried entering AGI for last year, again, no luck, and again TurboTax just sent me back to same page on turbotax. Why would turbotax expect that the same thing that didn't work five times would all of a sudden work. Had to file by paper. Meanwhile, don't know if my credit card payments from TurboTax went thru or not. Used this 11 years in a row and will NEVER use it again. see below | 45038959|0|0|0|0|0|0|1|0|0|0|0|0|0|0|334
3 |   not enough time allowed between confirmation code an signing back in | 45038227|0|0|0|0|0|0|0|0|0|0|0|1|0|0|335
2 | REJECTED Till this week I thought Turbo Tax was great. Now my return will be late. It got rejected no matter how I tried, per your online choices. Every method failed. I've never been late before. NOW WHAT? Rejected every time. | 45038198|0|0|1|0|0|0|0|0|0|0|0|0|0|0|336
2 | Disappointed This Year I have always liked TurboTax since I started using it several years ago. However, this year's filing has been a disaster! First time around, I ccompleted the entire filing and paying information, but for some reason, TurboTax didn't complete the process. So, I redid the entire filing, paying, etc. process again. Today, 4/17, I checked my tax return to find out that it was rejected. I do not know why, but I had to go through the entire process again, after obtaining a different PIN number. I am extremely upset at this whole debacle. I am a retired, disabled person of 70 years and I do not need this added aggrevation. Too many filing problems | 45037918|0|0|0|0|0|0|0|1|0|0|0|0|0|0|337
3 |  There is no an easy way to update information from prior year once it has been done.
My specific scenario: I started 2014 tax return and I was not done with 2013. It transfer the information from 2013 but when I finally finished the 2013 tax, they information on 2014 still does not reflect the changes made.

Your software does need to create a bottom to update information from prior years to address my point here. Update information from prior year | 45037836|0|0|0|0|0|1|0|0|0|0|0|0|0|0|338
3 | Potential for Excellence... but.. The product was excellent up until it was time to file. At that point in time everything fell apart. There were JavaScript errors that popped up when trying to connect. Having a technical background I could figure out how to get past those and click the connect button. Once I clicked the connect button it appeared the screen froze - i.e. no reaction.
I called tech support and received my call back. I was told it would be a 45 min wait it was over an hour and a half. When the person finally did call me, she read the issue description and told me it should not have been in her queue. She attempted to transfer me and dropped the call.
During this I brought the screen back up and came to the realization it hadn't froze, it was just extremely slow and it finally acknowledged logon.
Very disappointing experience trying to file.
Others had also reported the JavaScript errors Issues during submission process | 45037324|0|0|0|1|0|0|0|0|0|0|0|0|0|0|339
2 | I normally like Turbo but! Have been having an ordeal with my 1040 and three days later I am not sure if the 1040 I filed was ever accepted by the IRS. From the very first it told me I already filed and it has rejected my return five additional times. Makes me suspect that someone else may have filed a return using my SS# either maliciously or by accidentally. I guess I will find out soon enough. Hope it is not too costly or difficult to finalize. Could not get my copy of Turbo to do a 1041 for me. Had to do it the old fashioned way. | 45037302|0|0|1|0|0|0|0|0|0|0|0|0|0|0|340
2 | started great and ended up in the dumpster Turbo Tax Case #412133980 - Katina was absolutely wonderful after calling me when I left my number. She stuck with me through and through. Then we were cut off before we were finished and she did not call me back although She had the number because SHE had called me in the beginning. I went ahead and finished and am praying that my IL tax return is not rejected again. If she had called me back, I would not be telling you that there were a couple times when I felt she was trying to get rid of me by giving me wrong information and I had to point out why she was wrong. I had spent a long time trying to fix the rejected IL return myself before I called you. It did not go smoothly and I found the instructions confusing. I truly was surprised that Katina did not call me back because she was patient with me up until she cut me off and I would have given her a great review, if the return was accepted, of course. Illinois was rejected and I spent hours trying to fix, then called you. | 45037105|0|0|0|1|0|0|0|0|0|0|0|0|0|0|341
2 | wish it was better I thought the program itself for gathering information was good, I think the price was way too high. Also included way too many ads for additional services. When I was finished and found I owed Federal Taxes they still asked me how I wanted my refund. Then when the program asked me how I wanted to pay my taxes due they did not allow me to say I will arrange this with the IRS. This is the first year I have owed taxes in a long time and I will have to work out payments with the government. too expensive and too many ads for more services | 45036980|1|1|0|0|0|0|0|0|0|0|0|0|0|0|342
2 |  You tried to screw me by leaving certain sections out of the delux version! Do that again and I will leave torbo tax after 12 years!

Do you get it! Confusing after working on basic system and the working on the provide upgrade! | 45036968|1|0|0|0|0|0|0|1|0|0|0|0|0|0|343
1 | Not Good I hated my experience using Turbo Tax this year. I usually use HR Block. Turbo Tax was confusing and not simple. I was charged for the premium edition in order to proceed to filing. There was no other option even though it CLAIMED free federal return. I was charge $59 for something i didn't want. I didn't even see anything to click on which approved this $59. Even filing the state return was only supposed to be $29 but got included with this $59. Then after weeks of wondering where my return money was, i login and find out the system didn't actually "file" the return. When last time i logged out it was COMPLETE and FILED from what I could see. Not simple. Very confusing and not consistent. Confusing, and misleading | 45036856|0|1|1|0|0|0|0|1|0|0|0|0|0|0|344
1 | confusing my state file was rejected. they had a button click to fix. it was the worst. it didnt do it and was very confusing. no help at all.  | 45036750|0|0|1|0|1|0|0|0|1|0|0|0|0|0|345
1 | Took advantage of me I got upgraded mid taxes to the small home and business version because it was telling me I had over $100 in expenses (which was only my license fee and fee for insurance), but then never gave me the option to enter it. This cost me $50 more for nothing. On top of that, I have 2 dependents, one of which the other parent claimed as per our legal agreement, but this program still tried to claim him on the EIC this having my return rejected. When I pressed the option to have it fix the errors, it didn't fix anything and just refiled. I ended up having to delete my son altogether just so his ss# wouldn't appear on the schedule EIC. Upgraded me unnecessarily for $50 then couldn't fix errors. | 45036690|1|1|0|0|0|0|0|1|0|0|0|0|0|0|346
1 | Frustratedtaxpayer So tired of dealing with this. Why should I pay so much money for such a mess? I should get my money back from Turbo Tax for the problems that I have experienced this year. I have been trying to get this done, called for help, and still cannot get my taxes to go through. Now I have to worry about my personal information being stolen? Too much BS!!!!! no help | 45036502|1|0|0|1|0|0|0|1|0|0|0|0|0|0|347
1 | So annoyed! There seems to be an error within either IRS or Turbo Tax and even though I keep verifying and VERIFYING it keeps getting returned. WHERE THE HECK is Turbo Tax to help me now? Why does this keep happening? What am I supposed to do??????? can't file my return | 45036219|0|0|0|0|0|0|0|1|0|0|0|0|0|0|348
1 | Cannot E-File - 10 Attempts "We will help you FIX it" does NOT work - I eventually had to mail my tax! Failed to eFile - no adequate assistance | 45036200|0|0|1|0|0|0|1|0|0|0|0|0|0|0|349
3 | Less than stellar performance In the past, if I had an error in filing, and got rejected returns, the software would allow hands-on repairs, if necessary, to facilitate refiling. Never had a problem until this year, when the error was not corrected 5 times. I had to delete the info manually, by digging through reams of FAQ's and a long arduous process. The auto-repair "Fix-It-Now" button was not working at all! Won't auto-correct the error in filing, even after 5 attempts. | 45036132|1|0|0|0|0|0|0|1|0|0|0|0|0|0|350
3 | home & business this was all-full took at least 5 hours to get some to print for me to file call for help o 4 17 15 had to have everything print thru adobe COULD NOT GET IT TO PRINT OUT T TAX FILE SKIP/ | 45035811|0|0|0|1|0|0|0|0|0|0|1|0|0|0|351
3 | It was nice to be able to do taxes my taxes mysel I bought Turbotax Deluxe because our taxes are very simple. At least I thought they were. We own several MLP's and had some equity sales. II found out I needed to upgrade to Turbotax Premier at a cost of $32.03. I understood I would get a rebate of $25.00 when I filed my taxes. I saw no place to get this rebate when I filed my taxes.
I paid $59.99 when I bought Deluxe 1/5/2015. A short time later it was advertised that Premier was only $54.99 (it was much more expensive when I bought Turbotax).
It took forever to download the Premier upgrade. You did a big disservice to your users by failing to include the additional features for investment income.
The box Deluxe came in said there was 1 State product via download ( Print free or e-file for $19.99. When I went to e-file state taxes it said it would cost $24.95
I used Turbotax a number of years ago, then went to a CPA. Our tax situation has gotten much less complicated and I decided to use Turbotax again.
It really was a pain to deal with this year to get started. I sincerely hope you get the versions straightened out before 2015 tax filing.
HOW DO GET THE REBATE FOR HAVING TO UPGRADE TO PREMIER??? and the aggravation of having to download it??? Very difficult to download updates when I first got it. Site was so slow it shut me out several times. | 45035809|1|0|0|0|0|0|0|1|0|0|0|0|0|0|352
1 | REJECTED I've always used TurboTax in the past with no problems. That being said, this year I've had nothing but trouble. My file has been rejected at least 6 times and TurboTax supposedly helps correct it, but it keeps coming back rejected for the same error Doesn't work this year | 45035053|0|0|1|0|0|0|0|0|0|0|0|0|0|0|353
1 | This is frustrating This program does a terrible job of letting you see how the forms are being filled out as you go. Also, it incorrectly filled in a box on the state return (for something that I did not have and never input any information) so that the return gets rejected. Then, this program does not let you manually correct the box, so you end up having to mail in the return. What's the point? Incorrectly filled in state return and then cannot fix it so it gets rejected | 45035040|0|0|0|0|1|0|0|1|0|0|0|0|0|0|354
1 | Terrible with NYS Taxes Get through the Federal and NYS Taxes with no errors - try to efile and can't... Federal Return shows as being filed - but I file NYS. Have to print out both returns and mail them - because I am thinking neither return efiled correctly. Called TT help - it was terrible. I have been using this product for over 15 years - next year I won't. NY State E-Filing Problems | 45034973|0|0|1|0|0|0|1|0|0|0|0|0|0|0|355
1 | no Customer service Turbo tax took my money to file and would not submit the return. there was no way to contact a customer service rep to address the problem. Totally non responsive to multiple requests. waste of money and time. totally non responsive to requests for service | 45034757|1|0|1|1|0|0|0|0|0|0|0|0|0|0|356
3 | SIGNING IN INTO ACCOUNT I DON'T LIKE THE WAY YOU SETUP FOR VERIFING WHO YOUR ARE WHEN IN THE PASS WHEN YOU SIGN WITH YOUR USER PASSWORD AND STUFF IT WORKED WITH OUT A PROBLEM. THIS YEAR YOU CHANGED YOUR SYTEM TO AS QUESTIONS. AFTERING THE QUESTIONS RIGHT IT STILL WOULD NOT LET ME IN. SO I HAD TO CREATE A NEW USER ID AND PASSWORD AND NOW I GET MY RECORDS BACK AND THAT SUCKS I HAD TO CREATE A NEW USER PASSWORD | 45034014|0|0|0|0|0|0|0|1|0|0|0|0|0|0|357
1 |  was nt very helpful with questions about being double charged for a free service...not doing this again  | 45033651|1|0|0|0|0|0|0|1|0|0|0|0|0|0|358
2 |  Did not recognize 2013 filing. Have confirming emails demonstrating I clearly used TT.. Omission made 2014 filing difficult as one cannot "redo"2013 to create, i.e. won' permit filling forms from hard cc I kept.
