3 | charged more somehow there get you to click tell you pay by mistake is kinda scammy. not sure where i did it but somehow i signed up for plus. and couldnt get back far enought to find it. somehow they got me to click a box saying i wanted plus and dont really want plus. but i coulnt back up far enought | 45002221|1|1|0|0|0|0|0|0|0|0|0|0|0|0|564
1 | Surprise Fees I don't like surprises. $104 federal and $39.99 state with $39 deposit fee... What a rip! I'm taking my taxes elsewhere next year just because of lack of charges information when I began the return. Booooo! Huge fees not mentioned at start | 45002220|1|1|0|0|0|0|0|0|0|0|0|0|0|0|565
1 |    | 45002219|0|0|0|0|0|0|0|0|0|0|0|0|1|0|566
1 | Jesus - one simple line item 19 bucks extra You bait and switch lajdaki- 20 bucks extra to file an alimony line- never again. I'll paper file Stupidly expensive for an EZ form never again | 45002211|1|0|0|0|0|0|0|0|0|0|0|0|0|0|567
1 | Turbotax has become a scam To enter Health Savings Account info, Turbotax requires an upgrade fee over $50 (my checking account was charged $59.11). I chose the free version as usual but in the middle of preparing my tax return, I discovered I had become a prey species and had to pay Turbotax. It was not made clear at the start that if I had an HSA I would have to pay a substantial fee. The sneakiness is irksome. Will not be using Turbotax again. Upgrade fee a surprise | 45002203|1|1|0|0|0|0|0|0|0|0|0|0|0|0|568
1 | Lots of hidden fees They charge you to purchase TurboTax, a fee for upgrading to TurboTax Premier if you have *any* reason to file a 1040 (interest, dividends, capital gains, etc), a fee for your state return, a fee to *file* you state return online.

All these fees are not advertised and are presented *after* you painstakingly work through their mediocre software, thus committing yourself to using their service and paying their fees.

I WILL NOT USE THIS SERVICE AGAIN!!! Fees | 45002200|1|0|0|0|0|0|0|0|0|0|0|0|0|0|569
1 | Enjoy your vacation to Barbados! Enjoy your vacation! It's on me guys =) World Hunger | 45002198|0|0|0|0|0|0|0|0|0|0|0|1|0|0|570
1 |  The actual process of getting the upgrade to premier was not straightforward. Very frustrating. Hope Intuit gets smarter on this stuff. The process of upgrading to premier from deluxe in order to do what we used to do in deluxe is a huge blunder | 45002180|0|0|0|0|0|0|0|0|0|0|0|1|0|0|571
3 | Turbo help I would of paid for the upgrade but my tax return was so low.. when married you have all the stuff to fill which can be confusing | 45002177|0|0|0|0|0|0|0|1|0|0|0|0|0|0|572
1 | charged for product I didn't order when someone saysdo not add product don't add it when you say don't add product you shouldn't be charged | 45002171|1|0|0|0|0|0|0|0|0|0|0|0|0|0|573
1 | Easy... unless On the whole, Intuit provides a well rounded and easy to use product. I have used Intuit's software for the better part of a decade and find it to have consistent quality and have noticed some minor improvements through the years.

That said, there are a few areas that cause me to give an overall poor score.

1) The software and interview questions are well thought out and easy to follow but if you have trouble finding a specific topic or question, finding it and navigating to it can be challenging (for example, unreimbursed mileage is not easily accessible and is overly cumbersome).

2) Intuit's changes to the pricing model were confusing to say the least. As consumers, we would expect a product to maintain or improve its quality and prices should remain the same or decrease. Intuit has chosen to alienate its current customers to maximize its short-term profits due to product differentiation and lock-in and is not rewarding loyalty.

3) Probably the single biggest factor causing me to rate an otherwise good product with a poor score is Intuit's blatant dishonesty in pricing. When you select a product and are required to upgrade to get additional functionality, according to Intuit's website, you need to pay the difference between the prices for the upgrade. However, when you try to make the upgrade, Intuit charges an amount greater than the difference between the prices. Specifically, based on the prices posted on Intuit's website, there is a $25 difference between the Deluxe and Premier product, but an upgrade costs $30 plus tax. There is no easy or direct way to address this, so you simply must pay the additional amount despite Intuit saying it should not be that amount. Taking the time to find someone to charge you the right amount costs more than the difference in the prices. That is simply wrong and if it is not an honest error is actual an act of fraud. Considering we are expected to entrust Intuit with hour tax filing and trusting them to carefully check our returns for accuracy and to navigate the complicated tax laws, a simple oversight in how they charge for an upgrade seems unlikely and makes me wonder if they can be trusted to gather our information and report it correctly in the tax filing process. If we are to trust Intuit to be accurate in the details, then perhaps this was not an honest mistake at all and was an intentionally misleading and fraudulent decision. Complicated to find specific interview sections that should be easier to access | 45002157|1|1|0|0|0|0|0|0|0|0|0|0|0|0|574
3 | Not As Easy As The CD! Most difficult when attempting to pay Federal and State taxes; timed out when paying taxes and had to begin the process again. That is when I had to contact Technical Support and Customer Service to walk me through the process to complete filing. It is more difficult filing online than when I did with the CD. | 45002143|0|0|0|0|0|0|0|1|0|0|0|0|0|0|575
3 | updates were not working I waited until the last minute, of course, to file my return. When I tried to download Turbotax to my PC, it stalled on "Preparing to install" for 5 or so minutes before failing. My more modern Mac allowed me to install, but wanted to update. Every time I tried the update, I ran into an error and Turbotax wouldn't open. I tried all the workarounds suggested on help forums, but to no avail.

On the bright side, after waiting on hold for a long time, I did get through to a customer service rep at Turbotax, and he pushed me a version of Turbotax that worked. I was able to get my taxes done with one hour to spare. couldn't download Turbotax to PC or mac without help | 45002123|0|0|0|0|0|0|0|1|0|0|0|0|0|0|576
2 | tired took too long and I paid for it twice but was too tired to go back took too long | 45002122|1|0|0|0|0|0|0|0|0|0|0|0|0|0|577
1 |    | 45002121|0|0|0|0|0|0|0|0|0|0|0|0|1|0|578
3 |  Probably won't use Turbo Tax again! State taxes are very hard to get done. Oil and gas royaltys and rental income are a mess!!! | 45002120|0|0|0|0|1|0|0|0|0|0|0|0|0|0|579
3 |  bad experience this time around but felt good i understood what why i was making certain selections. Very insightful app. Information are saved at time and cannot be undone | 45002103|0|0|0|0|0|0|0|0|0|0|0|0|1|0|580
3 | Got the job done I went to pay for my state taxes to be filed with my refund and once I scrolled down, I saw that I was being charged almost $60 rather than the $29 fee. I clicked back and saw that they elected me to pay "plus" against my consent. I understand that they make money off of adding additional incentives but this took it beyond what was comfortable. I've used TurboTax for the past 5 years but this may be my last. Felt a little scammy this year. | 45002091|1|1|0|0|0|0|0|0|0|0|0|0|0|0|581
3 | Hidden Fee I understand paying $50.00 to have your taxes done as thoroughly as they do, but I don't understand having to pay an additional $39.95 for them to use a bank to disperse your funds into your account with no mention of this at the beginning, middle or even near the end of the process. They wait until the very end, which sucked. Otherwise you have the option to disagree with this fee and print it out instead and mail it in to the IRS yourself. Well, that's fine if you have a printer...but ...would if you don't? I also find it interesting that when you use the free filing option on Turbo Tax you don't have that fee of $39.95...hmmm. I know this because I filed my son's return for free with Turbo Tax at no charge and had it deposited straight into the same account as I did ours, Now that is awesome for him. Not so much for us...just doesn't make sense. We are the ones paying for the service and then have to pay even more to get our money. Even if you pay for the service by Credit Card you have to pay that fee of $39.95. Wow, Well, I think they need to disclose the extra fee right up front along side of the cost to use Turbo Tax. I found this deceitful as well as discouraging. Not sure I will go this process again next year. It is common knowledge that we all like to know costs up front. I considered this to be a hidden cost. So be aware! As you would and will not know this until you are finished and ready to pay for the cost of the service he very end. Hidden Cost | 45002089|1|1|0|0|0|0|0|0|0|0|0|0|0|0|582
1 | -Deceptive I came here due to your advertisements of "free e-filing, Federal and state" goodluck getting That from TurboTax, its just a lie told to get more customers coming. Youll still pay 30-60$.. Just tell people that no one likes scandalous businesses... Hope to see some improvement next year or I wont be using this software. A company that advertises one thing and gives you something else. | 45002083|1|1|0|0|0|0|0|0|0|0|0|0|0|0|583
1 | Disappointing this year Since they pulled that stunt of removing schedule C and jacking up the price to get it back ... then only relenting when there was an outcry ... just makes me very wary of using Intuit products. (I already stopped using Quicken when they insisted on frequent upgrades.) They also make it very hard to fill in the bank routing info on the state return if you want to mail it and avoid the e-file fee. This is all symptomatic of a company that has moved away from valuing its customers toward an attitude of arrogance instead. took out schedule C and fixed it too late | 45002056|1|0|0|0|0|0|1|0|0|0|0|0|0|0|584
1 | Bait'n'Switch The advertising indicated Fed and 3 state e-returns if I get the Deluxe Edition. Any extra states $19.99. When done with Fed and 1st State, Program wanted to charge $39.99 for a 2nd e-file state. Called Customer Service and was told I could not do an e-file 2nd state without paying, but reduced it to $19.99. I was irritated, but wanted to file all online. When I finally finished the returns the program wanted to charge me an additional $24..99 per state to actually e-file my returns. How do you get away with this? It should be criminal. I filed all returns by mail. Say one thing and once paid, keep charging to finish. | 45002039|1|0|0|1|0|0|0|0|0|0|0|0|0|0|585
1 | This app is ridiculously inept - No clear indication of where inputs map to filing forms.
- Erratic results that are perceived as complete yet change on subsequent visit.
- Summary screens are inconsistently filled with data.
- Interview process causes erratic results when deemed complete, yet visiting certain pages causes other questions to be spontaneously asked which then alter the inputs.
- Drill downs of results filled from interview questions direct you to make changes directly in the forms/schedules. Pathetically inconsistent and lacking transparency | 45002016|0|0|0|0|0|0|0|1|1|0|0|0|0|0|586
1 | Very poor service On 4/15/2015 acct log in to intuit broke down and couldn't be reset. The anxiety created was unbearable especially when I discovered that my Fed. Return wasn't filed till 4/16/2015@1:00a
I've never seen such a failure of communications like this in my life.
Turbo Tax is a great product, but this is your Super Bowl 4/15

Undependable when you need them most!!! You better hope someone else doesn't offer your exact service. I've been a customer over 10 yrs, and I was more than Very Disappointed.
A very courteous C/S agent helped me in the end. His name was Kelly. I can't believe the anguish he must have taken tonight, but he was very empathetic and calm.
Anything can happen especially in the electronic world. But not having someone available to speak with is inexcusable.
RL 3 hrs later @1:00a I finally got a callback 4/16.NOT GOOD | 45002004|0|0|0|1|0|0|0|0|0|0|0|0|0|0|587
3 | Continuity Turbo Tax is fairly easy to use, but when your personal income is derived from an S Corporation, it becomes much more complex.

I purchased the TurboTax Business, to file my S Corp. taxes, then I had to go out again and purchase another TT program from my 1040 Personal filing. It took at least a half an hour on hold to TT, before a very nice, knowledgeable, and helpful lady answered (understandable because it was April 14th). After going over all my info, it was determined that the only thing I really needed from my biz filing was my K-1 form. Thus she recommended I use TT Deluxe, which included this ability.

When I went back to my account, and selected Deluxe ($59.99), it ran me through everything I needed to do my taxes, but I had to manually enter my K-1 info, because it was unable to retrieve it.

When I was finally done and ready to file, I discovered that TT was actually charging me $104.00 for TT Home and Biz, rather than TT Deluxe like I had selected. They did this without explanation.

I was in a hurry so I paid what they asked, but I will be calling them after filing season and bringing this to their attention. It will be interesting to see how they respond.

I know that S corp filings are a bit complex, but when TT sees that there is only one shareholder listed, it would be great if they offered seamless continuity...or even if there is more than one share holder. The idea is to store and track biz filing...especially Form K-1...and/or allow storage of K-1 at a site TT can recognize and access, then make it easy for the filer to do his/her personal returns by recommending the precise package for it, and offer a discounted payment option right then and there, that would allow them to go straight to their 1040 filing, would import all pertinent K-1 data automatically, and then walk them through the entire process. Charged me for wrong package. Needs continuity between biz and personal | 45001982|1|0|0|0|0|0|0|0|0|0|0|0|0|0|588
1 | Overcharged and unsaved data I filed my taxes on turbotax at the end of March and I hit the SAVE button before logging out. This was after I entered all my information, up to the Healthcare section -- I had to stop there to call my insurance company the next day to see when my insurance started. After getting this information, I logged onto my turbotax account, and everything that I did was no longer there. Just gone. I spend at least an hour or more sitting in front of my computer and filling out all the forms the previous night. At this initial time, the turbotax prep fee was $27.99, but when I went back this past week it hiked up to a whopping $50 something... WHAT!? Thanks to the sudden hike in your charge, I ended up paying over $90 just for the prep fee. The only reason why I had to REDO it later is because turbotax failed to save my data despite the fact that I clicked the save button multiple times....

I want a refund. This is absolutely ridiculous.I have used TurboTax for mutiple years now,but this time around I feel cheated and taken advantage of. Will not be returning to Turbotax next year if this is how they treat their customers. Time for me to switch to H&R block. didn't save my tax return. sudden overcharge and hike up in their cost. | 45001972|1|0|0|0|0|0|0|1|0|0|0|0|0|0|589
3 | The good and the bad I had so much trouble finding a telephone # to even get any support. I did not appreciate filing an incident report JUST to get a stupid telephone support number. It sure felt like Turbo Tax does not want to take telephone calls. Then when you get one you have to wait an hour to get a call back. And heaven forbid if you don't get that call back answered on their first try because they won't call you back. You get to call back and start over. But by the time you get the call back, you're no longer in front of your computer and are in a car so you really don't get any answers then because you don't have information in front of you anymore. Even in my business, I attempt to call a customer 3 times before I just leave a message.

Second, I did not checkmark giving to the Presidential election fund but at the very end when I am done to print out a review, lo and behold, it is checked off that I want to give. So I search the online help, and find where to uncheck it. But...if you do that, it says it will have to amend your tax papers and you can't e-file if you do that. Even though I didn't submit the e-file yet, it said that. So then I was too paranoid to correct it for fear of missing the deadline. So we wound up giving $6 away that I didn't want to give.

The price. I had to pay $55 more dollars than last year because I am self-employed. I definitely did not feel that I got that much increase in the product to justify that huge increase in price. After this year's experience (we've used this for years), I am seriously thinking I'm either hiring someone else to do it, or trying another software.

The good was that I was familiar with the product so it didn't feel as daunting since I could bring stuff over from last year for comparisons, addresses, etc.

The e-filing is nice.

Ok that's all folks... Difficult to get # & phone support. Online help so-so. Having to give to pres fund. Huge price increase for same prod. | 45001969|1|0|0|1|0|0|0|0|0|0|0|0|0|0|590
3 | Well, darn it I owe ALOT!! I owe a lot this year due to an accounting error. I need to split my payment up some from bank account and some from credit card. Cant do that with this program, soo its a problem. Turbo Tax should allow multiple ways of paying with electronic cards. Would have been nice to put multiple accounts in to add up to the total amount due. I could have had everything done and paid for electronically in just a few minutes. Oh well.... haven't snail mailed anything in over a year... I wonder if I have any stamps. I needed to use more than one credit card to pay this year. Cant do that with turbo tax. | 45001966|1|0|0|0|0|0|0|0|0|0|0|0|0|0|591
1 | Form 3800 Could not get to form 3800 to enter a zero! You suck.

I want a refund.

My blood pressure is near killing me!!!!!!!!!!!!!!!!!!!!!!!!!!!!!!!!!!!!!!!!!!!!!!!!!!!!!!!!!!!!!

wsont take my image you such | 45001956|1|0|0|0|0|0|0|1|0|0|0|0|0|0|592
3 | You get what you pay for Glad I used it because I waited 'til the last minute and I had no problems with it. Paid out the nose, though. I would have paid close to the same price having gone to an accountant. Expensive | 45001950|1|0|0|0|0|0|0|0|0|0|0|0|0|0|593
1 |    | 45001935|0|0|0|0|0|0|0|0|0|0|0|0|1|0|594
1 | never again It's like the proverbial frog in boiling water (although the proverb isn't actually true)

I started using Quicken and TurboTax a very long time ago, and have continued despite rising disappointment.

It's gotten worse every year-- klunkier, more expensive, more features reserved for extra-cost versions, less help, sigh, and more.

No more, never again, hasta la nunca baby. it's worse every year | 45001929|1|0|0|0|0|0|0|1|1|0|0|0|0|0|595
3 |    | 45001927|0|0|0|0|0|0|0|0|0|0|0|0|1|0|596
2 | Hard to get answers I wanted to know where to input the costs of buying a business, however you get sent to a bunch of questions that are only vaguely similar but do not answer the question you want. That would be a great time to have a real person on the other end who you can talk with and they can direct you to the area you need to go or at least tell you it isn't possible to do it. Hard to get an answer to a simple question, hard to figure out what words to use to get a clear answer | 45001911|0|0|0|1|0|0|0|1|1|0|0|0|0|0|597
1 | Does not save info when you downgrade Ok for simple stuff, but when you are a independent contractor/self employed the delete your info when you want to transfer subscriptions and it takes forever;.....

I will not be using this TurboTax because they intentionally waste your time to force you to maintain they higher priced versions by deleting all you stuff. I've used them for years but will no longer after this ordeal..... ever.... again. BullSh#t when you try to downgrade and transfer ino | 45001902|1|0|0|0|0|1|0|0|0|0|0|0|0|0|598
3 | Mobile App - ehhh, not so much. I've been a Turbotax user for years. Tax season meant a trip to OfficeMax to buy the boxed software. A few years ago I switched to the online version, which worked very well for me. This year, yet another change - I tried the mobile app. No complaints whatsoever about entering my financial info - it worked quite well and was easy and intuitive.

So, I'm ready to submit... paying with my iTunes account??? Are you serious??? I don't trust those Apple clowns with my credit card!!! So, there must be an easy way to switch my payment preference to a credit card, right? Sure, just select the Print Center from the My Account drop down in the upper left. Conveniently, this works in a browser but despite clicking every possible option in the Mobile App... nothing. Sigh. Alas, I had to revert to the browser version to complete my filing process.

Now, one more gripe. Why is the credit card option buried under Print Center? I don't actually want to destroy a forest and print the ream of paper worth of my return (hence the mobile app and e-filing?). Why would Print Center be the obvious place to look for credit card options???

Intuit, I'd rate your Mobile App 5 stars, except for the payment issue, which brings it down to a 3 star. I spent more time searching for the credit card option than I did generating my entire return. It's 2015. Time to improve your mobile app. Unable to pay TurboTax fee with credit card from iPad- had to login from good old fashioned computer/browser :( | 45001883|1|0|0|0|0|0|1|0|0|0|0|0|0|0|599
1 | What customer service??? Although convenient, I was charged $39.99 for extra services without anyway to determine what it was for with time running out I attempted to contact the customer service # listed and number didn't include a 1 before number given. when this was determined after much time the number then said to call back when open. NOT open on April 15 Really! with no other option I agreed to the charges as time was at hand. I had already had to upgrade my service twice then was charged more that was unclear. I will continue to attempt to contact turbotax tomorrow and expect to find some satisfaction or I will devote my life to spreading the word of what a questionable operation I have experience you to be. charged $39.99 without explaination | 45001863|1|0|0|1|0|0|0|0|0|0|0|0|0|0|600
2 | price You advertise like this was totally free and it wasn't. False advertisement. I might do a real free service next time. They e file. wasn't free.To many questions | 45001861|1|1|0|0|0|0|0|0|0|0|0|0|0|0|601
3 | I Miss The Old TurboTax There is a lot to like in TurboTax Home & Business 2014.

It automatically detects last year's TurboTax file on my computer and imports my name, spouse's name, our SSNs, our address, occupations, W2, and 1099 information from last year. This helps a lot as it (a) saves typing and (b) increases accuracy.

After I complete entries for this year, TurboTax offers a detailed, side-by-side comparison of my return from last year and my return from this year. Additionally, it provides a side-by-side, 5-year tax history that highlights 24 major entries on returns for the current year and the past 4 years. Though not as detailed as the 2-year comparison mentioned earlier, there is sufficient detail that I can spot trends when they are present.

Save to PDF is a wonderful feature. Though I will probably never need them, I have PDFs for the current year and the past 12 years. The PDFs are of everything: tax returns, all worksheets, eFile electronic postmark, W-2s, and more. All of those files, along with their corresponding TurboTax files and supporting PDFs from banks, employers, and others occupy only 32 MB of space on my computer and I saved copies of all of these in 2 or 3 safe places in case my hard drive fails.

Despite using TurboTax for many years, I am frustrated by its cost, which seems to rise every year. I am, also, frustrated by the number of versions, how similar all of the packages look, and how poorly the packages (and the website) describe the pros and cons of each version. Both the packages and the website contain ambiguous, color-coded checkboxes that are arranged in columns next to generic, nebuous terms stripped of all meaning. Most years, I wait for the reviews to figure which version to buy.

Once I make a decision and go to the store to buy TurboTax, store personnel (who must go into a back room to get the software because only empty boxes are kept on store shelves) bring me the wrong box then argue with me about what I am buying. I have learned to walk into the store with the SKU code for the product that I need so that I get the correct item. Some years, it seems like I spend more time reading the reviews and obtaining the SKU code than I do using the software after I purchase it.

